title,subtitle
Por que a tecnologia 5G preocupa a Marinha dos EUA e os meteorologistas,"Para além das preocupações americanas com a espionagem chinesa, cientistas e militares temem que a rede 5G interfira, por exemplo, na previsão climática."
Estação Aurora: estamos mesmo próximos de ter um hotel no espaço?,Projeto pode se tornar o primeiro hotel no espaço. Mas quais são as reais chances de passarmos as férias em órbita ao redor da Terra?
Por que empresários como Bill Gates defendem a cobrança de impostos sobre robôs,Impacto do avanço da tecnologia sobre mercado de trabalho e possibilidade de desemprego em massa têm levado políticos e empresários a defender que Estado intervenha para evitar o pior; quais os argumentos contra e a favor nesse debate?
Por que a Samsung foi processada por propaganda enganosa na Austrália,"Segundo órgão de proteção ao consumidor australiano, telefones não são resistentes à água salgada ou a de piscinas, ao contrário do que foi divulgado por gigante de tecnologia sul-coreana."
Dopey: o podcast de ex-dependentes de heroína que atrai milhões de ouvintes,"Abordagem mais franca da questão é apontada como diferencial do programa que, no auge do sucesso, perdeu um dos criadores - morto por overdose"
Como a tecnologia pode evitar que você consuma alimentos contaminados,Nova tecnologia vai expor informações sobre a cadeia global de alimentos - dados que hoje são impossíveis de um consumidor acessar.
